{
  "surveyId": "sample-survey",
  "version": "1.0",
  "eventName": "샘플 행사",
  "deadline": "2099-12-31T23:59:59+09:00",
  "privacy": {
    "allowIdentity": false,
    "identityQuestions": []
  },
  "theme": "soft-blue",
  "intro": {
    "brand": "SURVEY FACTORY",
    "eyebrow": "SAMPLE",
    "paragraphs": [
      "샘플 행사에 대한 의견을 남겨주세요."
    ]
  },
  "respondent": {
    "label": "참여 구분을 선택해주세요.",
    "help": "",
    "options": [
      "참가자",
      "운영자"
    ]
  },
  "page": {
    "eyebrow": "SAMPLE FEEDBACK",
    "title": "샘플 평가",
    "lead": "경험한 항목을 평가해 주세요.",
    "done": "의견을 남겨주셔서 감사합니다."
  },
  "distribution": {
    "deadlineText": "샘플 미리보기",
    "sender": "SURVEY FACTORY",
    "greeting": "안녕하세요.",
    "thanks": "샘플 행사에 참여해 주셔서 감사합니다.",
    "purpose": "행사 경험과 개선 의견을 수집합니다.",
    "whyYou": "참가자의 경험을 바탕으로 개선점을 파악합니다.",
    "usage": "다음 행사 준비에 활용합니다.",
    "ask": "적극적인 의견을 부탁드립니다.",
    "ripple": "함께 참여한 분들께도 알려주세요."
  },
  "collector": {
    "adapter": "local-mock",
    "endpoint": "http://127.0.0.1:18791/submit"
  },
  "payload": {
    "format": "standard"
  },
  "title": "샘플 전문가 설문",
  "eventDate": "2026-10-02",
  "scale": {
    "enabled": true,
    "min": 0,
    "max": 10,
    "baseline": 5,
    "baselineLabel": "기준 = 5점",
    "baselineName": "기준",
    "lowLabel": "낮음",
    "sameLabel": "비슷함",
    "highLabel": "높음",
    "allowNotEvaluated": true
  },
  "sections": [
    {
      "id": "experience",
      "title": "행사 경험",
      "subtitle": "전체 경험을 평가해 주세요.",
      "theme": "soft-blue",
      "questions": [
        {
          "id": "Q01",
          "type": "score",
          "prompt": "전반적인 경험",
          "required": true
        },
        {
          "id": "Q02",
          "type": "text",
          "prompt": "개선 의견",
          "required": true,
          "linkedScores": [
            "Q01"
          ]
        },
        {
          "id": "Q03",
          "type": "singleChoice",
          "prompt": "참여 방식",
          "required": true,
          "options": [
            "현장",
            "온라인"
          ]
        },
        {
          "id": "Q04",
          "type": "multiChoice",
          "prompt": "관심 항목",
          "required": false,
          "options": [
            "교육",
            "체험"
          ]
        }
      ]
    }
  ]
}
